{
  "api_version": "metactl/v2alpha1",
  "subject_ref": {
    "kind": "target",
    "id": "claude-code",
    "version": "2026.03.25"
  },
  "status": "pass",
  "checks": [
    {
      "id": "schema-compile-manifest",
      "status": "pass",
      "message": "Compile manifest validates against schema.",
      "artifact_ref": {
        "kind": "output",
        "id": "claude-md"
      }
    },
    {
      "id": "policy-enforcement-report",
      "status": "pass",
      "message": "All requested local policies were realized without degradation.",
      "artifact_ref": {
        "kind": "artifact",
        "id": "policy-report"
      }
    },
    {
      "id": "generated-output-digests",
      "status": "pass",
      "message": "Generated outputs match recorded digests.",
      "artifact_ref": {
        "kind": "output",
        "id": "claude-settings"
      }
    }
  ],
  "generated_at": "2026-03-25T20:00:00Z"
}
